{
  "schemaVersion": "1.0.0",
  "id": "tour_bunbun_golden",
  "title": "Bunbun: a truth story",
  "subtitle": "How a comment travels from a browser island to an ATProto record",
  "audience": "new-contributor",
  "project": {
    "slug": "bunbun",
    "name": "Bunbun",
    "revision": {
      "commit": "9fef24d",
      "branch": "main",
      "dirty": false
    }
  },
  "chapters": [
    {
      "id": "chapter_purpose",
      "title": "What Bunbun is",
      "summary": "A discussion service on the AT Protocol, with records as the source of truth and a local index for reads.",
      "diagrams": [
        {
          "id": "diagram_sources",
          "kind": "architecture",
          "title": "Records, index, and readers",
          "nodes": [
            {
              "id": "node_web",
              "label": "Web islands",
              "type": "client"
            },
            {
              "id": "node_api",
              "label": "NestJS API",
              "type": "service"
            },
            {
              "id": "node_pds",
              "label": "ATProto PDS",
              "type": "external",
              "anchorId": "anchor_readme_overview"
            },
            {
              "id": "node_index",
              "label": "Local index",
              "type": "store",
              "anchorId": "anchor_readme_overview"
            }
          ],
          "edges": [
            {
              "id": "edge_web_api",
              "from": "node_web",
              "to": "node_api",
              "kind": "calls"
            },
            {
              "id": "edge_api_pds",
              "from": "node_api",
              "to": "node_pds",
              "kind": "writes"
            },
            {
              "id": "edge_api_index",
              "from": "node_api",
              "to": "node_index",
              "kind": "reads"
            },
            {
              "id": "edge_pds_index",
              "from": "node_pds",
              "to": "node_index",
              "kind": "writes",
              "label": "reconcile"
            }
          ]
        },
        {
          "id": "diagram_repo_map",
          "kind": "tree",
          "title": "Repository map",
          "nodes": [
            {
              "id": "node_repo",
              "label": "bunbun",
              "type": "module",
              "anchorId": "anchor_readme_layout"
            },
            {
              "id": "node_apps_api",
              "label": "apps/api",
              "type": "module",
              "anchorId": "anchor_readme_layout"
            },
            {
              "id": "node_apps_web",
              "label": "apps/web",
              "type": "module",
              "anchorId": "anchor_readme_layout"
            },
            {
              "id": "node_acceptance",
              "label": "browser-acceptance",
              "type": "module",
              "anchorId": "anchor_readme_layout"
            },
            {
              "id": "node_docs",
              "label": "docs",
              "type": "module",
              "anchorId": "anchor_docs_index"
            },
            {
              "id": "node_plans",
              "label": "plans",
              "type": "module",
              "anchorId": "anchor_readme_layout"
            }
          ],
          "edges": [
            {
              "id": "edge_repo_api",
              "from": "node_repo",
              "to": "node_apps_api",
              "kind": "contains"
            },
            {
              "id": "edge_repo_web",
              "from": "node_repo",
              "to": "node_apps_web",
              "kind": "contains"
            },
            {
              "id": "edge_repo_acceptance",
              "from": "node_repo",
              "to": "node_acceptance",
              "kind": "contains"
            },
            {
              "id": "edge_repo_docs",
              "from": "node_repo",
              "to": "node_docs",
              "kind": "contains"
            },
            {
              "id": "edge_repo_plans",
              "from": "node_repo",
              "to": "node_plans",
              "kind": "contains"
            }
          ]
        },
        {
          "id": "diagram_domain",
          "kind": "architecture",
          "title": "The domain in one picture",
          "nodes": [
            {
              "id": "node_user",
              "label": "User",
              "type": "module"
            },
            {
              "id": "node_bun",
              "label": "Bun",
              "type": "module"
            },
            {
              "id": "node_thread",
              "label": "Thread",
              "type": "module"
            },
            {
              "id": "node_comment",
              "label": "Comment",
              "type": "module",
              "anchorId": "anchor_context_glossary"
            },
            {
              "id": "node_reply",
              "label": "Reply",
              "type": "module"
            }
          ],
          "edges": [
            {
              "id": "edge_user_comment",
              "from": "node_user",
              "to": "node_comment",
              "kind": "writes"
            },
            {
              "id": "edge_bun_thread",
              "from": "node_bun",
              "to": "node_thread",
              "kind": "contains"
            },
            {
              "id": "edge_thread_comment",
              "from": "node_thread",
              "to": "node_comment",
              "kind": "contains"
            },
            {
              "id": "edge_comment_reply",
              "from": "node_comment",
              "to": "node_reply",
              "kind": "contains"
            }
          ]
        }
      ],
      "beats": [
        {
          "id": "beat_purpose_01",
          "title": "Two sources, one conversation",
          "narration": "Bunbun is a comment and discussion service built on the AT Protocol. Buns and threads are persisted as ATProto records, and a local index serves reads alongside the PDS source of truth. The index is a read model and a cache; it is never the place where a conversation truly lives.",
          "durationMs": 32000,
          "anchors": [
            {
              "id": "anchor_readme_overview",
              "path": "README.md",
              "lines": {
                "start": 3,
                "end": 3
              },
              "contentHash": "sha256:c9fb2aa2f68d98766b87108ba9a253469cb791937ad9090cbfd1049378ffeb82",
              "label": "What Bunbun is",
              "language": "markdown",
              "excerpt": "Bunbun is a comment and discussion service built on the [AT Protocol](https://atproto.com). Users authenticate with ATProto app passwords, buns (discussion groups) and threads are persisted as ATProto records, and a local index serves reads alongside the PDS source of truth. See [CONTEXT.md](CONTEXT.md) for the domain language (Account, Bun, Thread, Comment, Reply)."
            }
          ],
          "stage": {
            "anchorIds": ["anchor_readme_overview"],
            "diagramId": "diagram_sources",
            "nodeIds": ["node_pds", "node_index"],
            "edgeIds": ["edge_pds_index", "edge_api_index"]
          },
          "suggestedQuestions": [
            "Why keep a local index if the PDS is the source of truth?"
          ]
        },
        {
          "id": "beat_purpose_02",
          "title": "Three application surfaces",
          "narration": "The repository is a pnpm workspace with three application surfaces. apps/api is the NestJS service, apps/web is the browser island bundle served same-origin, and apps/browser-acceptance is an opt-in Playwright tier. docs and plans hold the project's memory.",
          "durationMs": 30000,
          "anchors": [
            {
              "id": "anchor_readme_layout",
              "path": "README.md",
              "lines": {
                "start": 19,
                "end": 29
              },
              "contentHash": "sha256:076eefd3318f412eaa8d797e154c252058f263f327fcd368eaeefd3af713a51e",
              "label": "Repository layout",
              "language": "markdown",
              "excerpt": "## Repository layout\n\nBunbun is a pnpm workspace monorepo:\n\n```\napps/api                 @bunbun/api — the NestJS API (source, tests, migrations, configs)\napps/web                 @bunbun/web — the Svelte island bundle, served same-origin at /islands\napps/browser-acceptance  @bunbun/browser-acceptance — opt-in Playwright acceptance tier\ndocs/                    per-domain documentation\nplans/                   project plans\n```"
            }
          ],
          "stage": {
            "anchorIds": ["anchor_readme_layout"],
            "diagramId": "diagram_repo_map",
            "nodeIds": ["node_repo", "node_apps_api", "node_apps_web", "node_acceptance"]
          }
        },
        {
          "id": "beat_purpose_03",
          "title": "One glossary, shared by everyone",
          "narration": "The domain language is explicit. Account, User, Bun, Thread, Comment, and Reply each mean one thing. A bun is a discussion group represented by an ATProto identity, a thread belongs to one bun, and replies nest inside a thread. The glossary is required reading before changing domain code.",
          "durationMs": 34000,
          "anchors": [
            {
              "id": "anchor_context_glossary",
              "path": "CONTEXT.md",
              "lines": {
                "start": 3,
                "end": 9
              },
              "contentHash": "sha256:c3db74696606d67c139d1e174b699870295b5d73fa5efa51f40ceb29e4d512a6",
              "label": "Domain glossary",
              "language": "markdown",